{
  "evidence_id": "urn:obo:ev:payments:20260401:declined",
  "obo_credential_ref": "urn:obo:cred:payments:vi:20260401:0001",
  "credential_digest_ref": "sha256:aaaaaaaaaaaaaaaaaaaaaaaaaaaaaaaaaaaaaaaaaaaaaaaaaaaaaaaaaaaaaaaa",
  "principal_id": "did:example:principal:user-anon-002",
  "agent_id": "agent.pay42.psp.eu.example",
  "operator_id": "psp.eu.example",
  "intent_hash": "sha256:3333333333333333333333333333333333333333333333333333333333333333",
  "intent_class": "urn:obo:ns:payments:card-payment-authorize",
  "action_class": "C",
  "outcome": "deny",
  "reason_code": "policy:risk_score_threshold_exceeded",
  "policy_snapshot_ref": "urn:policy:vi:psd3:risk:v1",
  "governance_framework_ref": "urn:pack:rtgf:psd3:sha256:fed987cba654",
  "sealed_at": 1775045886,
  "corridor_ref": "payments-psd3.corridor.eu.example",
  "corridor_admission_tier": "regulated",
  "corridor_predicate_digest": "sha256:d3f4a5b6c7d8e9f0a1b2c3d4e5f6a7b8c9d0e1f2a3b4c5d6e7f8a9b0c1d2e3f4",
  "target_id": "merchant_paris_014",
  "stage3_ref": "txn_20260401_91339:decline",
  "profile_id": "payments-mastercard-vi",
  "profile_evidence": {
    "event_type": "payment_declined",
    "correlation_id": "corr_order_8479",
    "trace_id": "3bf92f3577b34da6a3ce929d0e0e1111",
    "amount_minor": 3049,
    "currency": "EUR",
    "reason_codes": [
      "ontology:payments.initiate.sepa.risk_declined",
      "policy:risk_score_threshold_exceeded"
    ]
  },
  "evidence_digest": "sha256:3030303030303030303030303030303030303030303030303030303030303030",
  "envelope_sig": "Ed25519:GGGGGGGGGGGGGGGGGGGGGGGGGGGGGGGGGGGGGGGGGGGGGGGGGGGGGGGGGGGGGGGGGGGGGGGGGGGGGGGGGG"
}
