{
  "evidence_id": "urn:obo:ev:swift:20260403:sending-bank-accepted",
  "obo_credential_ref": "urn:obo:cred:swift:treasury:20260403:0001",
  "credential_digest_ref": "sha256:bbbbbbbbbbbbbbbbbbbbbbbbbbbbbbbbbbbbbbbbbbbbbbbbbbbbbbbbbbbbbbbb",
  "principal_id": "did:example:principal:corp-treasury-officer",
  "agent_id": "agent.treasury.corp.example.uk",
  "operator_id": "corp.example.uk",
  "intent_hash": "sha256:7777777777777777777777777777777777777777777777777777777777777777",
  "intent_class": "urn:obo:ns:payments:swift:pacs008-forward",
  "action_class": "C",
  "outcome": "allow",
  "reason_code": "none",
  "policy_snapshot_ref": "urn:policy:swift-iso20022:hsbc:v1",
  "governance_framework_ref": "urn:pack:swift-iso20022:sha256:001122334455",
  "sealed_at": 1775207685,
  "prior_evidence_ref": "urn:obo:ev:swift:20260403:instruction-initiated",
  "corridor_ref": "payments-swift.corridor.lane2.example",
  "corridor_admission_tier": "regulated",
  "corridor_predicate_digest": "sha256:e4f5a6b7c8d9e0f1a2b3c4d5e6f7a8b9c0d1e2f3a4b5c6d7e8f9a0b1c2d3e4f5",
  "target_id": "DEUTDEDBFRA",
  "stage3_ref": "123e4567-e89b-12d3-a456-426614174000",
  "profile_id": "payments-swift-iso20022",
  "profile_evidence": {
    "message_type": "pacs.008",
    "message_id": "msg-20260403-HSBC-001",
    "uetr": "123e4567-e89b-12d3-a456-426614174000",
    "instruction_id": "INSTR-20260403-001",
    "end_to_end_id": "E2E-CORP-20260403-001",
    "amount_minor": 500000,
    "currency": "USD",
    "reason_codes": [
      "ontology:payments.credit_transfer.swift.pacs008.forwarded",
      "policy:sending_bank.compliance_check.passed"
    ]
  },
  "evidence_digest": "sha256:7070707070707070707070707070707070707070707070707070707070707070",
  "envelope_sig": "Ed25519:KKKKKKKKKKKKKKKKKKKKKKKKKKKKKKKKKKKKKKKKKKKKKKKKKKKKKKKKKKKKKKKKKKKKKKKKKKKKKKKKKK"
}
