{
  "evidence_id": "urn:obo:ev:2026:p1a2y3m4",
  "obo_credential_ref": "urn:obo:cred:2026:p9q8r7s6",
  "credential_digest_ref": "sha256:aaaaaaaaaaaaaaaaaaaaaaaaaaaaaaaaaaaaaaaaaaaaaaaaaaaaaaaaaaaaaaaa",
  "principal_id": "did:example:principal:bob",
  "agent_id": "urn:agent:fintech-co:payment-agent:v2",
  "operator_id": "fintech-co.example",
  "intent_hash": "sha256:2222222222222222222222222222222222222222222222222222222222222222",
  "intent_class": "urn:obo:ns:payments:credit-transfer",
  "action_class": "C",
  "outcome": "allow",
  "reason_code": "none",
  "policy_snapshot_ref": "urn:policy:rtgf:psd3:v2.1.0",
  "governance_framework_ref": "urn:pack:rtgf:psd3:sha256:fed987cba654",
  "sealed_at": 1743552400,
  "corridor_ref": "urn:aarp:corridor:eu:psd3:payments",
  "corridor_admission_tier": "regulated",
  "corridor_predicate_digest": "sha256:1111111111111111111111111111111111111111111111111111111111111111",
  "target_id": "urn:bank:example-bank:payment-api:v3",
  "stage3_ref": "urn:payment:sepa:CT-2026-04-02-000001",
  "why_ref": {
    "rationale_id": "urn:rtgf:rationale:psd3:art65:2026:r001",
    "rationale_digest": "sha256:1122334455667788990011223344556677889900112233445566778899001122",
    "derivation_digest": "sha256:aabbccddeeff00112233445566778899aabbccddeeff0011223344556677aabb"
  },
  "route_proof_ref": "urn:aarp:route-proof:sha256:9988776655443322",
  "evidence_digest": "sha256:ffffffffffffffffffffffffffffffffffffffffffffffffffffffffffffffff",
  "envelope_sig": "Ed25519:DDDDDDDDDDDDDDDDDDDDDDDDDDDDDDDDDDDDDDDDDDDDDDDDDDDDDDDDDDDDDDDDDDDDDDDDDDDDDDDDDD"
}
